[
  {
    "protocol_version": 1,
    "message_id": "00000000-0000-4000-8000-000000002711",
    "kind": "request",
    "type": "harness.coordination.resolve",
    "type_version": 1,
    "source": "00000000-0000-4000-8000-000000000001",
    "target": "00000000-0000-4000-8000-000000000002",
    "operation_id": "00000000-0000-4000-8000-0000000002b2",
    "delivery": {
      "mode": "reliable",
      "stream_id": "00000000-0000-4000-8000-000000007531",
      "seq": "1",
      "retain_until": "2026-09-25T10:00:00.000Z",
      "scope": {
        "kind": "operation",
        "id": "00000000-0000-4000-8000-0000000002b2"
      }
    },
    "authorization": {
      "grant_ref": "runtime-fixture-grant"
    },
    "expires_at": "2026-09-24T10:10:00.000Z",
    "payload": {
      "query_id": "00000000-0000-4000-8000-0000000002b2",
      "agent_id": "00000000-0000-4000-8000-00000000003c",
      "revision": "1"
    }
  },
  {
    "protocol_version": 1,
    "message_id": "00000000-0000-4000-8000-000000002712",
    "kind": "response",
    "type": "harness.coordination.resolve",
    "type_version": 1,
    "source": "00000000-0000-4000-8000-000000000002",
    "target": "00000000-0000-4000-8000-000000000001",
    "operation_id": "00000000-0000-4000-8000-0000000002b2",
    "delivery": {
      "mode": "reliable",
      "stream_id": "00000000-0000-4000-8000-000000007532",
      "seq": "1",
      "retain_until": "2026-09-25T10:00:00.000Z",
      "scope": {
        "kind": "operation",
        "id": "00000000-0000-4000-8000-0000000002b2"
      }
    },
    "payload": {
      "status": "completed",
      "result": {
        "query_id": "00000000-0000-4000-8000-0000000002b2",
        "binding": {
          "agent_id": "00000000-0000-4000-8000-00000000003c",
          "revision": "1",
          "implementation_sha256": "bbbbbbbbbbbbbbbbbbbbbbbbbbbbbbbbbbbbbbbbbbbbbbbbbbbbbbbbbbbbbbbb",
          "actor_id": "00000000-0000-4000-8000-00000000003e",
          "host_endpoint": "00000000-0000-4000-8000-000000000002",
          "task_authority": "00000000-0000-4000-8000-000000000001",
          "mode": "internal",
          "input_contract": "notes.input@1",
          "result_contract": "notes.result@1",
          "supports_pause": true,
          "supports_input": true,
          "supports_authorization_wait": true,
          "proof": {
            "authority_endpoint": "00000000-0000-4000-8000-000000000001",
            "proof_id": "00000000-0000-4000-8000-00000000003f",
            "revision": "1",
            "binding_sha256": "aaaaaaaaaaaaaaaaaaaaaaaaaaaaaaaaaaaaaaaaaaaaaaaaaaaaaaaaaaaaaaaa",
            "issued_at": "2026-09-24T10:00:00.000Z",
            "expires_at": "2026-09-24T10:10:00.000Z"
          }
        }
      }
    },
    "reply_to": "00000000-0000-4000-8000-000000002711"
  },
  {
    "protocol_version": 1,
    "message_id": "00000000-0000-4000-8000-000000002713",
    "kind": "request",
    "type": "harness.coordination.delegate",
    "type_version": 1,
    "source": "00000000-0000-4000-8000-000000000001",
    "target": "00000000-0000-4000-8000-000000000002",
    "operation_id": "00000000-0000-4000-8000-0000000002bc",
    "delivery": {
      "mode": "reliable",
      "stream_id": "00000000-0000-4000-8000-000000007533",
      "seq": "1",
      "retain_until": "2026-09-25T10:00:00.000Z",
      "scope": {
        "kind": "operation",
        "id": "00000000-0000-4000-8000-0000000002bc"
      }
    },
    "authorization": {
      "grant_ref": "runtime-fixture-grant"
    },
    "expires_at": "2026-09-24T10:10:00.000Z",
    "payload": {
      "delegation_operation_id": "00000000-0000-4000-8000-0000000002bc",
      "parent_task_id": "00000000-0000-4000-8000-0000000002bb",
      "parent_owner_epoch": "1",
      "task_authority": "00000000-0000-4000-8000-000000000001",
      "mode": "internal",
      "agent_binding": {
        "agent_id": "00000000-0000-4000-8000-00000000003c",
        "revision": "1",
        "implementation_sha256": "bbbbbbbbbbbbbbbbbbbbbbbbbbbbbbbbbbbbbbbbbbbbbbbbbbbbbbbbbbbbbbbb",
        "actor_id": "00000000-0000-4000-8000-00000000003e",
        "host_endpoint": "00000000-0000-4000-8000-000000000002",
        "task_authority": "00000000-0000-4000-8000-000000000001",
        "mode": "internal",
        "input_contract": "notes.input@1",
        "result_contract": "notes.result@1",
        "supports_pause": true,
        "supports_input": true,
        "supports_authorization_wait": true,
        "proof": {
          "authority_endpoint": "00000000-0000-4000-8000-000000000001",
          "proof_id": "00000000-0000-4000-8000-00000000003f",
          "revision": "1",
          "binding_sha256": "aaaaaaaaaaaaaaaaaaaaaaaaaaaaaaaaaaaaaaaaaaaaaaaaaaaaaaaaaaaaaaaa",
          "issued_at": "2026-09-24T10:00:00.000Z",
          "expires_at": "2026-09-24T10:10:00.000Z"
        }
      },
      "goal": "取得方案甲资料并保留来源",
      "constraints": [
        "仅使用批准信息源"
      ],
      "acceptance_binding": {
        "authority_endpoint": "00000000-0000-4000-8000-000000000001",
        "proof_id": "00000000-0000-4000-8000-000000000040",
        "revision": "1",
        "binding_sha256": "aaaaaaaaaaaaaaaaaaaaaaaaaaaaaaaaaaaaaaaaaaaaaaaaaaaaaaaaaaaaaaaa",
        "issued_at": "2026-09-24T10:00:00.000Z",
        "expires_at": "2026-09-24T10:10:00.000Z"
      },
      "input_refs": [
        {
          "content_id": "00000000-0000-4000-8000-000000000041",
          "provider_endpoint": "00000000-0000-4000-8000-000000000001",
          "media_type": "text/plain",
          "size": "64",
          "sha256": "aaaaaaaaaaaaaaaaaaaaaaaaaaaaaaaaaaaaaaaaaaaaaaaaaaaaaaaaaaaaaaaa"
        }
      ],
      "source_bindings": [
        {
          "source_authority": "00000000-0000-4000-8000-000000000001",
          "resource_ref": "public:test-fixture",
          "revision": "1",
          "sha256": "aaaaaaaaaaaaaaaaaaaaaaaaaaaaaaaaaaaaaaaaaaaaaaaaaaaaaaaaaaaaaaaa",
          "observed_at": "2026-09-24T10:00:00.000Z",
          "policy_ref": "00000000-0000-4000-8000-000000000032",
          "policy_revision": "1",
          "purposes": [
            "task",
            "evaluation",
            "release"
          ],
          "recipients": [
            "00000000-0000-4000-8000-000000000001",
            "00000000-0000-4000-8000-000000000002",
            "00000000-0000-4000-8000-000000000004",
            "00000000-0000-4000-8000-000000000005",
            "00000000-0000-4000-8000-000000000006",
            "00000000-0000-4000-8000-000000000007"
          ],
          "processing_endpoints": [
            "00000000-0000-4000-8000-000000000001",
            "00000000-0000-4000-8000-000000000002",
            "00000000-0000-4000-8000-000000000004",
            "00000000-0000-4000-8000-000000000005",
            "00000000-0000-4000-8000-000000000006",
            "00000000-0000-4000-8000-000000000007"
          ],
          "retain_until": "2026-09-25T10:00:00.000Z",
          "current_proof": {
            "authority_endpoint": "00000000-0000-4000-8000-000000000001",
            "proof_id": "00000000-0000-4000-8000-000000000033",
            "revision": "1",
            "binding_sha256": "aaaaaaaaaaaaaaaaaaaaaaaaaaaaaaaaaaaaaaaaaaaaaaaaaaaaaaaaaaaaaaaa",
            "issued_at": "2026-09-24T10:00:00.000Z",
            "expires_at": "2026-09-24T10:10:00.000Z"
          }
        }
      ],
      "authorization_binding": {
        "authority_endpoint": "00000000-0000-4000-8000-000000000001",
        "proof_id": "00000000-0000-4000-8000-000000000042",
        "revision": "1",
        "binding_sha256": "aaaaaaaaaaaaaaaaaaaaaaaaaaaaaaaaaaaaaaaaaaaaaaaaaaaaaaaaaaaaaaaa",
        "issued_at": "2026-09-24T10:00:00.000Z",
        "expires_at": "2026-09-24T10:10:00.000Z"
      },
      "budget_allocation": {
        "allocation_id": "00000000-0000-4000-8000-000000000034",
        "revision": "1",
        "owner_task_id": "00000000-0000-4000-8000-0000000002bd",
        "amounts": [
          {
            "dimension": "cost",
            "unit": "currency_minor_unit",
            "currency": "USD",
            "scale": 6,
            "target_limit": "100000",
            "cleanup_limit": "10000",
            "mode": "hard"
          }
        ],
        "mode": "hard",
        "proof": {
          "authority_endpoint": "00000000-0000-4000-8000-000000000001",
          "proof_id": "00000000-0000-4000-8000-000000000035",
          "revision": "1",
          "binding_sha256": "aaaaaaaaaaaaaaaaaaaaaaaaaaaaaaaaaaaaaaaaaaaaaaaaaaaaaaaaaaaaaaaa",
          "issued_at": "2026-09-24T10:00:00.000Z",
          "expires_at": "2026-09-24T10:10:00.000Z"
        }
      },
      "start_before": "2026-09-24T10:10:00.000Z",
      "task_deadline": "2026-09-24T10:10:00.000Z",
      "ancestry": [],
      "max_depth": 4,
      "retain_until": "2026-09-25T10:00:00.000Z",
      "intent_sha256": "cccccccccccccccccccccccccccccccccccccccccccccccccccccccccccccccc",
      "child_task_id": "00000000-0000-4000-8000-0000000002bd"
    }
  },
  {
    "protocol_version": 1,
    "message_id": "00000000-0000-4000-8000-000000002714",
    "kind": "response",
    "type": "harness.coordination.delegate",
    "type_version": 1,
    "source": "00000000-0000-4000-8000-000000000002",
    "target": "00000000-0000-4000-8000-000000000001",
    "operation_id": "00000000-0000-4000-8000-0000000002bc",
    "delivery": {
      "mode": "reliable",
      "stream_id": "00000000-0000-4000-8000-000000007534",
      "seq": "1",
      "retain_until": "2026-09-25T10:00:00.000Z",
      "scope": {
        "kind": "operation",
        "id": "00000000-0000-4000-8000-0000000002bc"
      }
    },
    "payload": {
      "status": "accepted",
      "result": {
        "delegation_operation_id": "00000000-0000-4000-8000-0000000002bc",
        "recorded": true,
        "contract_sha256": "cccccccccccccccccccccccccccccccccccccccccccccccccccccccccccccccc",
        "snapshot": {